{
  "reviewed": true,
  "kind": "native-cad-viewport-turntable",
  "title": "Native CAD model inspection",
  "caption": "100×60×5 mm plate, four 8 mm holes. Camera animation captured from SolidWorks after prepared-spec build. No chat conversion filmed.",
  "src": "assets/media/gage-demo.mp4",
  "poster": "assets/media/poster.jpg",
  "captions": "assets/media/gage-demo.en.vtt",
  "transcript": "assets/media/gage-demo-transcript.txt",
  "width": 1280,
  "height": 960,
  "requestedDurationSeconds": 30,
  "durationSeconds": 30,
  "requestedGeometry": {
    "units": "mm",
    "plateDimensions": [
      100,
      60,
      5
    ],
    "holeCount": 4,
    "holeDiameter": 8
  },
  "verifiedGeometry": {
    "units": "mm",
    "plateDimensions": [
      100,
      60,
      5
    ],
    "holeCount": 4,
    "holeDiameter": 8
  },
  "provenance": {
    "captureMethod": "native-SaveBMP-sequence",
    "buildMethod": "prepared-spec",
    "chatConversionFilmed": false,
    "syntheticGeometry": false,
    "syntheticFrames": false,
    "uiAnimation": false,
    "educationalWatermarkPreserved": true,
    "parentApproved": true,
    "geometryEvidence": "Parent verified unchanged before/after geometry and part hash: 100x60x5 mm, four diameter-8 through-holes at X +/-35 and Y +/-20 mm, net volume validated. V2: all 120 native frames screened with 48 px boundary and 12 encoded samples visually reviewed without clipping. Browser playback QA pending. See assets/media/native-demo-provenance.json.",
    "captureDate": "2026-10-15"
  },
  "sha256": {
    "video": "cd53fe9f6d9515abd00b9a26a0260368dee7b0f53c28bbb4f70cc65f109fa93e",
    "poster": "bf80878f33b88918526479511a4919057a230fff3780bb72033bf7b785be42dc",
    "captions": "0b10b500a218f3d99cff67f5fc9d17e8c0161a3148b4e6aa245932d497001111",
    "transcript": "da551041f50aec000d64542413588294d3c4a7782cc964c715d85cf817261510"
  }
}
