{
  "reviewed": false,
  "kind": "native-cad-viewport-turntable",
  "title": "Native CAD model inspection",
  "caption": "100×60×5 mm plate, four 8 mm holes. Camera animation captured from SolidWorks after prepared-spec build. No chat conversion filmed.",
  "src": "assets/media/gage-demo.mp4",
  "poster": "assets/media/poster.jpg",
  "captions": "assets/media/gage-demo.en.vtt",
  "transcript": "assets/media/gage-demo-transcript.txt",
  "width": null,
  "height": null,
  "requestedDurationSeconds": 30,
  "durationSeconds": null,
  "requestedGeometry": {
    "units": "mm",
    "plateDimensions": [100, 60, 5],
    "holeCount": 4,
    "holeDiameter": 8
  },
  "verifiedGeometry": null,
  "provenance": {
    "captureMethod": "native-SaveBMP-sequence",
    "buildMethod": "prepared-spec",
    "chatConversionFilmed": false,
    "syntheticGeometry": false,
    "syntheticFrames": false,
    "uiAnimation": false,
    "educationalWatermarkPreserved": null,
    "parentApproved": false,
    "geometryEvidence": null,
    "captureDate": null
  },
  "sha256": {
    "video": null,
    "poster": null,
    "captions": null,
    "transcript": null
  }
}
